{"schemaVersion":1,"generatedAt":"2026-10-27T06:45:58.821Z","nowHour":"2026-10-27T10:00+04:00","lastMeasuredAir":"2026-10-27T08:00+04:00","site":"https://zboule.github.io/abu-dhabi-outside/","profiles":{"kids":{"limits":{"feelsGood":31,"feelsOk":35,"uvGood":4,"uvOk":6,"airGood":75,"airOk":100,"dustGood":100,"dustOk":200,"poolGood":27,"poolOk":24},"hours":[{"time":"2026-10-27T00:00+04:00","night":true,"verdict":"ok","heat":"ok","uv":"good","air":"ok","pool":"ok","temp":31,"feels":35,"uvIndex":0,"airIndex":93,"pollution":93,"dust":39,"airSource":"measured","reason":"hot, feels 35°, pollution 93 (non-dust fine particles)","heatColor":"#eecb2b","strongSun":false,"badAir":null},{"time":"2026-10-27T01:00+04:00","night":true,"verdict":"ok","heat":"ok","uv":"good","air":"ok","pool":"ok","temp":30,"feels":35,"uvIndex":0,"airIndex":93,"pollution":93,"dust":39,"airSource":"measured","reason":"hot, feels 35°, pollution 93 (non-dust fine particles)","heatColor":"#e4cd2d","strongSun":false,"badAir":null},{"time":"2026-10-27T02:00+04:00","night":true,"verdict":"ok","heat":"ok","uv":"good","air":"ok","pool":"ok","temp":30,"feels":34,"uvIndex":0,"airIndex":92,"pollution":92,"dust":43,"airSource":"measured","reason":"hot, feels 34°, pollution 92 (non-dust fine particles)","heatColor":"#d0d130","strongSun":false,"badAir":null},{"time":"2026-10-27T03:00+04:00","night":true,"verdict":"ok","heat":"ok","uv":"good","air":"ok","pool":"ok","temp":30,"feels":34,"uvIndex":0,"airIndex":91,"pollution":91,"dust":44,"airSource":"measured","reason":"hot, feels 34°, pollution 91 (non-dust fine particles)","heatColor":"#cbd231","strongSun":false,"badAir":null},{"time":"2026-10-27T04:00+04:00","night":true,"verdict":"ok","heat":"ok","uv":"good","air":"ok","pool":"ok","temp":30,"feels":35,"uvIndex":0,"airIndex":94,"pollution":94,"dust":41,"airSource":"measured","reason":"hot, feels 35°, pollution 94 (non-dust fine particles)","heatColor":"#dfce2e","strongSun":false,"badAir":null},{"time":"2026-10-27T05:00+04:00","night":true,"verdict":"ok","heat":"ok","uv":"good","air":"ok","pool":"ok","temp":30,"feels":34,"uvIndex":0,"airIndex":92,"pollution":92,"dust":43,"airSource":"measured","reason":"hot, feels 34°, pollution 92 (non-dust fine particles)","heatColor":"#d0d130","strongSun":false,"badAir":null},{"time":"2026-10-27T06:00+04:00","night":true,"verdict":"ok","heat":"good","uv":"good","air":"ok","pool":"ok","temp":29,"feels":34,"uvIndex":0.2,"airIndex":89,"pollution":89,"dust":46,"airSource":"measured","reason":"pollution 89 (non-dust fine particles)","heatColor":"#c6d332","strongSun":false,"badAir":null},{"time":"2026-10-27T07:00+04:00","night":false,"verdict":"ok","heat":"ok","uv":"good","air":"ok","pool":"ok","temp":29,"feels":34,"uvIndex":0.8,"airIndex":92,"pollution":92,"dust":46,"airSource":"measured","reason":"hot, feels 34°, pollution 92 (non-dust fine particles)","heatColor":"#ff7c1d","strongSun":false,"badAir":null},{"time":"2026-10-27T08:00+04:00","night":false,"verdict":"bad","heat":"bad","uv":"good","air":"ok","pool":"ok","temp":31,"feels":36,"uvIndex":2.5,"airIndex":96,"pollution":96,"dust":46,"airSource":"measured","reason":"hot, feels 36°, pollution 96 (non-dust fine particles)","heatColor":"#fd423a","strongSun":false,"badAir":null},{"time":"2026-10-27T09:00+04:00","night":false,"verdict":"bad","heat":"bad","uv":"ok","air":"ok","pool":"ok","temp":32,"feels":37,"uvIndex":4.6,"airIndex":92,"pollution":92,"dust":50,"airSource":"forecast","reason":"hot, feels 37°, UV 4.5, pollution 92 (non-dust fine particles)","heatColor":"#f63838","strongSun":false,"badAir":null},{"time":"2026-10-27T10:00+04:00","night":false,"verdict":"bad","heat":"bad","uv":"bad","air":"ok","pool":"bad","temp":34,"feels":38,"uvIndex":6.3,"airIndex":81,"pollution":81,"dust":54,"airSource":"forecast","reason":"hot, feels 38°, UV 6.3, pollution 81 (non-dust fine particles)","heatColor":"#f13137","strongSun":true,"badAir":null},{"time":"2026-10-27T11:00+04:00","night":false,"verdict":"bad","heat":"bad","uv":"bad","air":"good","pool":"bad","temp":35,"feels":39,"uvIndex":6.5,"airIndex":72,"pollution":72,"dust":59,"airSource":"forecast","reason":"hot, feels 39°, UV 6.5","heatColor":"#ed2b36","strongSun":true,"badAir":null},{"time":"2026-10-27T12:00+04:00","night":false,"verdict":"bad","heat":"bad","uv":"bad","air":"good","pool":"bad","temp":35,"feels":39,"uvIndex":6.5,"airIndex":66,"pollution":66,"dust":62,"airSource":"forecast","reason":"hot, feels 39°, UV 6.5","heatColor":"#ec2a36","strongSun":true,"badAir":null},{"time":"2026-10-27T13:00+04:00","night":false,"verdict":"bad","heat":"bad","uv":"ok","air":"good","pool":"ok","temp":35,"feels":39,"uvIndex":5.8,"airIndex":65,"pollution":61,"dust":65,"airSource":"forecast","reason":"hot, feels 39°, UV 5.8","heatColor":"#ef2e37","strongSun":false,"badAir":null},{"time":"2026-10-27T14:00+04:00","night":false,"verdict":"bad","heat":"bad","uv":"ok","air":"good","pool":"ok","temp":34,"feels":38,"uvIndex":4.3,"airIndex":65,"pollution":57,"dust":65,"airSource":"forecast","reason":"hot, feels 38°, UV 4.3","heatColor":"#f23337","strongSun":false,"badAir":null},{"time":"2026-10-27T15:00+04:00","night":false,"verdict":"bad","heat":"bad","uv":"good","air":"good","pool":"good","temp":34,"feels":37,"uvIndex":2.4,"airIndex":65,"pollution":56,"dust":65,"airSource":"forecast","reason":"hot, feels 37°","heatColor":"#f83b39","strongSun":false,"badAir":null},{"time":"2026-10-27T16:00+04:00","night":false,"verdict":"bad","heat":"bad","uv":"good","air":"good","pool":"good","temp":33,"feels":36,"uvIndex":0.9,"airIndex":62,"pollution":56,"dust":62,"airSource":"forecast","reason":"hot, feels 36°","heatColor":"#fb3f39","strongSun":false,"badAir":null},{"time":"2026-10-27T17:00+04:00","night":false,"verdict":"bad","heat":"bad","uv":"good","air":"good","pool":"good","temp":33,"feels":36,"uvIndex":0.2,"airIndex":59,"pollution":59,"dust":59,"airSource":"forecast","reason":"hot, feels 36°","heatColor":"#fd423a","strongSun":false,"badAir":null},{"time":"2026-10-27T18:00+04:00","night":true,"verdict":"ok","heat":"ok","uv":"good","air":"good","pool":"good","temp":32,"feels":35,"uvIndex":0,"airIndex":62,"pollution":62,"dust":56,"airSource":"forecast","reason":"hot, feels 35°","heatColor":"#ffc627","strongSun":false,"badAir":null},{"time":"2026-10-27T19:00+04:00","night":true,"verdict":"ok","heat":"ok","uv":"good","air":"good","pool":"good","temp":32,"feels":35,"uvIndex":0,"airIndex":64,"pollution":64,"dust":53,"airSource":"forecast","reason":"hot, feels 35°","heatColor":"#ffc126","strongSun":false,"badAir":null},{"time":"2026-10-27T20:00+04:00","night":true,"verdict":"ok","heat":"ok","uv":"good","air":"good","pool":"good","temp":31,"feels":36,"uvIndex":0,"airIndex":65,"pollution":65,"dust":51,"airSource":"forecast","reason":"hot, feels 36°","heatColor":"#ffbe25","strongSun":false,"badAir":null},{"time":"2026-10-27T21:00+04:00","night":true,"verdict":"ok","heat":"ok","uv":"good","air":"good","pool":"good","temp":31,"feels":35,"uvIndex":0,"airIndex":66,"pollution":66,"dust":47,"airSource":"forecast","reason":"hot, feels 35°","heatColor":"#ffc126","strongSun":false,"badAir":null},{"time":"2026-10-27T22:00+04:00","night":true,"verdict":"ok","heat":"ok","uv":"good","air":"good","pool":"good","temp":31,"feels":36,"uvIndex":0,"airIndex":69,"pollution":69,"dust":42,"airSource":"forecast","reason":"hot, feels 36°","heatColor":"#ffbb24","strongSun":false,"badAir":null},{"time":"2026-10-27T23:00+04:00","night":true,"verdict":"ok","heat":"ok","uv":"good","air":"good","pool":"good","temp":30,"feels":36,"uvIndex":0,"airIndex":74,"pollution":74,"dust":37,"airSource":"forecast","reason":"hot, feels 36°","heatColor":"#ffbb24","strongSun":false,"badAir":null},{"time":"2026-10-28T00:00+04:00","night":true,"verdict":"ok","heat":"ok","uv":"good","air":"ok","pool":"ok","temp":30,"feels":36,"uvIndex":0,"airIndex":79,"pollution":79,"dust":33,"airSource":"forecast","reason":"hot, feels 36°, pollution 79 (non-dust fine particles)","heatColor":"#ffbb24","strongSun":false,"badAir":null},{"time":"2026-10-28T01:00+04:00","night":true,"verdict":"ok","heat":"ok","uv":"good","air":"ok","pool":"ok","temp":29,"feels":35,"uvIndex":0,"airIndex":82,"pollution":82,"dust":29,"airSource":"forecast","reason":"hot, feels 35°, pollution 82 (non-dust fine particles)","heatColor":"#ffc326","strongSun":false,"badAir":null},{"time":"2026-10-28T02:00+04:00","night":true,"verdict":"ok","heat":"ok","uv":"good","air":"ok","pool":"ok","temp":29,"feels":35,"uvIndex":0,"airIndex":86,"pollution":86,"dust":28,"airSource":"forecast","reason":"hot, feels 35°, pollution 86 (non-dust fine particles)","heatColor":"#f9c929","strongSun":false,"badAir":null},{"time":"2026-10-28T03:00+04:00","night":true,"verdict":"ok","heat":"ok","uv":"good","air":"ok","pool":"ok","temp":29,"feels":35,"uvIndex":0,"airIndex":92,"pollution":92,"dust":30,"airSource":"forecast","reason":"hot, feels 35°, pollution 92 (non-dust fine particles)","heatColor":"#e9cc2c","strongSun":false,"badAir":null},{"time":"2026-10-28T04:00+04:00","night":true,"verdict":"ok","heat":"ok","uv":"good","air":"ok","pool":"ok","temp":28,"feels":34,"uvIndex":0,"airIndex":98,"pollution":98,"dust":30,"airSource":"forecast","reason":"hot, feels 34°, pollution 98 (non-dust fine particles)","heatColor":"#d5d02f","strongSun":false,"badAir":null},{"time":"2026-10-28T05:00+04:00","night":true,"verdict":"bad","heat":"good","uv":"good","air":"bad","pool":"bad","temp":28,"feels":34,"uvIndex":0,"airIndex":103,"pollution":103,"dust":29,"airSource":"forecast","reason":"pollution 103 (non-dust fine particles)","heatColor":"#c2d433","strongSun":false,"badAir":"smog"},{"time":"2026-10-28T06:00+04:00","night":true,"verdict":"bad","heat":"good","uv":"good","air":"bad","pool":"bad","temp":27,"feels":34,"uvIndex":0.2,"airIndex":106,"pollution":106,"dust":27,"airSource":"forecast","reason":"pollution 106 (non-dust fine particles)","heatColor":"#b8d634","strongSun":false,"badAir":"smog"},{"ti